Entity,Freq uently,Occasionally,Rarely,Never
Avoid interacting with others who are near you,616,16.0,31,46.0
Get informationor details about people planning to youare see,12,24.0,27,36.0
"For no pa rticular reason, just for something to do",18,32.0,23,27.0
To catch up on fother tasks you need mplish to acco,18,34.0,25,22.0
To catch up with family and friends,29,38.0,20,12.0
To coord linate getting together with others,29,nan,21,nan
Look sup information abo ut where you going getthere are or how to,33,32.0,13,22.0
